{
  "id": "019a2b3c-4d5e-7f00-8a00-000000000002",
  "name": "Nagy Anna",
  "role": "supervisor",
  "pin_hash": null,
  "pin_salt": null,
  "pin_iterations": null,
  "active": true,
  "site_ids": [
    "019a2b3c-4d5e-7f00-8a00-000000000001"
  ],
  "created_at": "2026-10-20T08:00:00.000Z",
  "updated_at": "2026-10-27T10:05:12.345Z"
}
