{
  "id": "019a2b3c-4d5e-7f00-8a00-000000000003",
  "name": "Kiss Péter",
  "role": "guard",
  "pin_hash": "q83vEjRWeJCrze8SNFZ4kKvN7xI0VniQq83vEjRWeJA=",
  "pin_salt": "q83vEjRWeJCrze8SNFZ4kA==",
  "pin_iterations": 100000,
  "active": true,
  "site_ids": [
    "019a2b3c-4d5e-7f00-8a00-000000000001"
  ],
  "created_at": "2026-10-20T08:00:00.000Z",
  "updated_at": "2026-10-27T10:05:12.345Z"
}
